{
  "schema_version": "1.0",
  "digest_date": "2026-10-09",
  "window": {
    "from": "2026-10-03",
    "to": "2026-10-09"
  },
  "topics": [
    "rag",
    "retrieval",
    "agents",
    "tool_use",
    "llm_production",
    "evaluation",
    "observability",
    "memory",
    "safety",
    "guardrails",
    "architecture"
  ],
  "weekly_changes": [
    {
      "summary": "La memoria operativa necesita reparación verificable antes de que el agente vuelva a actuar.",
      "why_it_matters": "StateWise eleva la corrección de 38.7% a 93.3% bajo estado persistente corrompido al identificar registros decisivos, verificar hechos en modo read-only, aclarar intención y conservar linaje de reparación."
    },
    {
      "summary": "Aprender de la experiencia de serving sigue siendo distinto de ser capaz de resolver la tarea.",
      "why_it_matters": "ServeLearnBench encuentra que la adaptación continua puede ser costosa y degradar comportamiento ya correcto; explorar y detectar cambios de política son cuellos de botella explícitos."
    },
    {
      "summary": "La optimización de RAG mejora cuando diagnostica si cada fallo pertenece a retrieval o generación.",
      "why_it_matters": "Agentic AutoRAG alcanza o supera en 10 pruebas la calidad que optimizadores estadísticos logran en 30 y, en salud, mejora precisión con menor costo por consulta."
    },
    {
      "summary": "La evaluación de agentes está migrando de outcomes agregados hacia trazas, mecanismos y procesos.",
      "why_it_matters": "LiveMACE muestra que acceso a tools o memoria, uso efectivo y rendimiento final no son equivalentes; retornos similares pueden ocultar conductas y cuellos de botella distintos."
    },
    {
      "summary": "Relevancia no implica que una memoria sea admisible ni que una evidencia deba ser obedecida.",
      "why_it_matters": "Los nuevos trabajos sobre admisibilidad y RAG-Stress separan recuperación, exposición y divulgación, y muestran que priorizar documentos puede aumentar entre 10.9 y 13.5 puntos la sustitución dañina de respuestas correctas."
    }
  ],
  "items": [
    {
      "id": "arxiv:2610.05241",
      "title": "StateWise: Diagnosing and Repairing Persistent Operational State Before Agent Actions",
      "type": "paper",
      "selection_basis": "new_publication",
      "published_at": "2026-10-04",
      "updated_at": null,
      "authors": [
        "Yongyuan Peng",
        "Zhou Feng",
        "Tongying Wu",
        "Jiahao Chen",
        "Yuan Su",
        "Chunyi Zhou",
        "Tianyu Du",
        "Shouling Ji"
      ],
      "organization": null,
      "url": "https://arxiv.org/abs/2610.05241",
      "external_ids": {
        "doi": "10.48550/arXiv.2610.05241",
        "arxiv": "2610.05241"
      },
      "topics": [
        "agents",
        "tool_use",
        "memory",
        "safety",
        "architecture"
      ],
      "summary": "Marco para detectar cuándo registros operativos persistentes ya no son válidos, repararlos con evidencia vinculada a cada registro y replanificar antes de ejecutar acciones.",
      "what_changed": "Convierte la revisión del estado en una etapa previa y explícita: contrafactuales para hallar registros decisivos, verificación read-only de hechos observables, aclaración dirigida de intención y un chequeo independiente estado-acción.",
      "why_it_matters": "En agentes duraderos, revisar sólo la acción actual no corrige premisas obsoletas que volverán a reutilizarse. El patrón propone persistir tanto la corrección como su evidencia y alcance.",
      "evidence": [
        "Evalúa 150 casos ejecutables de agentes de código en entornos, workspaces y repositorios diversos.",
        "Bajo estado corrompido logra 93.3% de corrección frente a 38.7% del baseline.",
        "Los autores reportan cero acciones inseguras y transferencia entre repositorios e interfaces de tools."
      ],
      "limitations": [
        "La evidencia se concentra en coding agents y corrupción inducida del estado.",
        "La verificación read-only y las aclaraciones añaden latencia y dependen de que existan fuentes observables o un dueño de intención disponible."
      ],
      "practical_applications": [
        "design",
        "deployment",
        "agents",
        "safety"
      ],
      "reading_recommendation": "full_read",
      "priority": "high",
      "source_tier": "primary"
    },
    {
      "id": "arxiv:2610.07309",
      "title": "The Right Memory in the Wrong Context: Verifying Retrieval Admissibility in Long-Term Agent Memory",
      "type": "paper",
      "selection_basis": "new_publication",
      "published_at": "2026-10-05",
      "updated_at": null,
      "authors": [
        "Zi Wang",
        "Xingqiao Wang",
        "Emmanuel Addai",
        "Devika Ambekar",
        "Xiaowei Xu"
      ],
      "organization": null,
      "url": "https://arxiv.org/abs/2610.07309",
      "external_ids": {
        "doi": "10.48550/arXiv.2610.07309",
        "arxiv": "2610.07309"
      },
      "topics": [
        "retrieval",
        "agents",
        "memory",
        "evaluation",
        "safety",
        "guardrails"
      ],
      "summary": "Propone verificar por separado si una memoria recuperada es admisible para el principal, política y estado de ciclo de vida actuales, además de rastrear exposición en prompt y divulgación final.",
      "what_changed": "Añade una taxonomía ternaria —admisible, inadmisible o no resuelta— y compara rutas con recall de evidencia requerida emparejado, evitando que una ruta parezca segura sólo porque omitió evidencia.",
      "why_it_matters": "Un vector store multiusuario o con políticas cambiantes puede recuperar información muy relevante pero prohibida. El control de acceso debe ocurrir antes de que el texto entre al prompt, no sólo en la respuesta final.",
      "evidence": [
        "Reanaliza rankings congelados de RHELM y MemOps para 3,767 consultas.",
        "El filtrado por namespace eleva el recall top-20 de anchors de 0.432 a 0.533 y reduce 98.3% las comparaciones exactas de similitud.",
        "En 1,523 casos emparejados, el routing por namespace se asocia con mejoras de accuracy juzgada de 0.053 a 0.068, aunque el recall también cambia."
      ],
      "limitations": [
        "Parte del análisis de routing es observacional y no identifica por sí solo causalidad.",
        "Los intervalos de divulgación en 16 escenarios controlados son amplios; sólo uno de cuatro excluye cero."
      ],
      "practical_applications": [
        "design",
        "evaluation",
        "retrieval",
        "safety"
      ],
      "reading_recommendation": "full_read",
      "priority": "high",
      "source_tier": "primary"
    },
    {
      "id": "arxiv:2610.07792",
      "title": "ServeLearnBench: How Well Can Agents Self-Improve from Serving Experience?",
      "type": "benchmark",
      "selection_basis": "new_publication",
      "published_at": "2026-10-06",
      "updated_at": null,
      "authors": [
        "Haizhong Zheng",
        "Yizhuo Di",
        "Ranajoy Sadhukhan",
        "Shuowei Jin",
        "Beidi Chen"
      ],
      "organization": null,
      "url": "https://arxiv.org/abs/2610.07792",
      "external_ids": {
        "doi": "10.48550/arXiv.2610.07792",
        "arxiv": "2610.07792"
      },
      "topics": [
        "agents",
        "llm_production",
        "evaluation",
        "observability",
        "memory",
        "architecture"
      ],
      "summary": "Benchmark de adaptación continua en entornos donde políticas ocultas cambian y el agente debe inferir, aplicar y revisar conocimiento desde interacción y feedback.",
      "what_changed": "Introduce un dataset streaming de entorno evolutivo con retail, banca y generación de pitches, y compara RAG, Mem0, SkillOpt, Continual Harness y Prime bajo múltiples modelos.",
      "why_it_matters": "Evita asumir que acumular experiencia produce mejora monotónica. Obliga a medir costo de adaptación, regresiones sobre comportamiento correcto, exploración y velocidad de detección de cambios.",
      "evidence": [
        "Incluye 53 ventanas de entorno y 7,718 tareas.",
        "Cubre 28 pares modelo-harness y 252 corridas de aprendizaje.",
        "Encuentra una brecha entre capacidad y aprendizaje, degradación de respuestas ya correctas y exploración insuficiente como cuello de botella."
      ],
      "limitations": [
        "Los dominios y cambios de política son controlados y pueden no reflejar el ruido de producción.",
        "Los resultados comparan una selección finita de seis modelos y cinco harnesses."
      ],
      "practical_applications": [
        "design",
        "evaluation",
        "deployment",
        "agents",
        "observability"
      ],
      "reading_recommendation": "full_read",
      "priority": "high",
      "source_tier": "primary"
    },
    {
      "id": "arxiv:2610.08452",
      "title": "Agentic AutoRAG: RAG Pipeline Optimization through Reasoning-Driven Agents",
      "type": "paper",
      "selection_basis": "new_publication",
      "published_at": "2026-10-06",
      "updated_at": null,
      "authors": [
        "Lasse B. Strand",
        "Robert Jakob",
        "Kevin O'Sullivan",
        "Markus Kreft"
      ],
      "organization": null,
      "url": "https://arxiv.org/abs/2610.08452",
      "external_ids": {
        "doi": "10.48550/arXiv.2610.08452",
        "arxiv": "2610.08452"
      },
      "topics": [
        "rag",
        "retrieval",
        "agents",
        "llm_production",
        "evaluation",
        "architecture"
      ],
      "summary": "Optimizador multiobjetivo de pipelines RAG que diagnostica cada fallo como retrieval o generación y usa esa atribución para proponer la siguiente configuración sobre un examen congelado.",